{
  "schema_version": "2.1",
  "message_id": "c3d4e5f6-4e81-4daf-c051-4e5f60718293",
  "message_type": "observation.lab",
  "clinic_id": "CLINIC001",
  "gateway_id": "GW-PI5-001",
  "sequence_no": 10238,
  "timestamps": {
    "measured_at": "2026-10-20T09:02:00.000+07:00",
    "received_at": "2026-10-20T09:02:05.000+07:00",
    "sent_at": "2026-10-20T09:02:06.000+07:00",
    "clock_source": "ntp"
  },
  "device": {
    "device_id": "LAB-05",
    "device_type": "chemistry_analyzer",
    "serial_number": "SN-LAB05-0001",
    "firmware_version": "1.0.0",
    "connection": "lan",
    "mac_address": "A4:C1:38:00:00:05",
    "device_class": "commercial"
  },
  "patient": {
    "patient_id": "BN-2026-000123",
    "encounter_id": "ENC-2026-0456"
  },
  "patient_binding": {
    "method": "qr_scan",
    "operator_id": "NV-014",
    "bound_at": "2026-10-20T08:46:00+07:00"
  },
  "measurements": [
    {
      "code": {
        "system": "LOINC",
        "code": "1742-6",
        "display": "Alanine aminotransferase (ALT)"
      },
      "value": 28,
      "unit": "U/L",
      "status": "final",
      "quality": {
        "signal_quality": null,
        "confidence": null
      },
      "device_flags": {}
    },
    {
      "code": {
        "system": "LOINC",
        "code": "1920-8",
        "display": "Aspartate aminotransferase (AST)"
      },
      "value": 24,
      "unit": "U/L",
      "status": "final",
      "quality": {
        "signal_quality": null,
        "confidence": null
      },
      "device_flags": {}
    },
    {
      "code": {
        "system": "LOINC",
        "code": "2324-2",
        "display": "Gamma glutamyl transferase (GGT)"
      },
      "value": 30,
      "unit": "U/L",
      "status": "final",
      "quality": {
        "signal_quality": null,
        "confidence": null
      },
      "device_flags": {}
    },
    {
      "code": {
        "system": "LOINC",
        "code": "1975-2",
        "display": "Bilirubin total"
      },
      "value": 0.8,
      "unit": "mg/dL",
      "status": "final",
      "quality": {
        "signal_quality": null,
        "confidence": null
      },
      "device_flags": {}
    },
    {
      "code": {
        "system": "LOINC",
        "code": "2345-7",
        "display": "Glucose [Mass/volume] in Serum or Plasma"
      },
      "value": 114,
      "unit": "mg/dL",
      "status": "final",
      "quality": {
        "signal_quality": null,
        "confidence": null
      },
      "device_flags": {}
    }
  ]
}