{
  "schema_version": "2.1",
  "message_id": "7b3f2c10-9a4e-4f2b-8c1d-0a1b2c3d4e5f",
  "message_type": "observation.vitals",
  "clinic_id": "CLINIC001",
  "gateway_id": "GW-PI5-001",
  "sequence_no": 10234,
  "timestamps": {
    "measured_at": "2026-10-20T08:52:00.000+07:00",
    "received_at": "2026-10-20T08:52:00.420+07:00",
    "sent_at": "2026-10-20T08:52:01.050+07:00",
    "clock_source": "ntp"
  },
  "device": {
    "device_id": "BP-01",
    "device_type": "blood_pressure",
    "serial_number": "SN-BP01-0001",
    "firmware_version": "1.0.0",
    "connection": "ble",
    "mac_address": "A4:C1:38:00:00:01",
    "device_class": "commercial"
  },
  "patient": {
    "patient_id": "BN-2026-000123",
    "encounter_id": "ENC-2026-0456"
  },
  "patient_binding": {
    "method": "qr_scan",
    "operator_id": "NV-014",
    "bound_at": "2026-10-20T08:46:00+07:00"
  },
  "measurements": [
    {
      "code": {
        "system": "LOINC",
        "code": "85354-9",
        "display": "Blood pressure panel"
      },
      "value": null,
      "unit": "mm[Hg]",
      "status": "final",
      "components": [
        {
          "code": {
            "system": "LOINC",
            "code": "8480-6"
          },
          "value": 122,
          "unit": "mm[Hg]"
        },
        {
          "code": {
            "system": "LOINC",
            "code": "8462-4"
          },
          "value": 77,
          "unit": "mm[Hg]"
        },
        {
          "code": {
            "system": "LOINC",
            "code": "8478-0"
          },
          "value": 92,
          "unit": "mm[Hg]"
        }
      ],
      "quality": {
        "signal_quality": "good",
        "confidence": null
      },
      "device_flags": {
        "cuff_loose": false,
        "motion_detected": false
      }
    },
    {
      "code": {
        "system": "LOINC",
        "code": "8867-4",
        "display": "Heart rate"
      },
      "value": 72,
      "unit": "/min",
      "status": "final",
      "quality": {
        "signal_quality": "good",
        "confidence": null
      },
      "device_flags": {}
    }
  ]
}