{
  "schema_version": "2.1",
  "message_id": "a1b2c3d4-2c6f-4b8d-ae3f-2c3d4e5f6071",
  "message_type": "observation.vitals",
  "clinic_id": "CLINIC001",
  "gateway_id": "GW-PI5-001",
  "sequence_no": 10236,
  "timestamps": {
    "measured_at": "2026-10-20T08:50:00.000+07:00",
    "received_at": "2026-10-20T08:50:00.250+07:00",
    "sent_at": "2026-10-20T08:50:00.800+07:00",
    "clock_source": "ntp"
  },
  "device": {
    "device_id": "TMP-07",
    "device_type": "thermometer",
    "serial_number": "SN-TMP07-0001",
    "firmware_version": "1.0.0",
    "connection": "ble",
    "mac_address": "A4:C1:38:00:00:07",
    "device_class": "commercial"
  },
  "patient": {
    "patient_id": "BN-2026-000123",
    "encounter_id": "ENC-2026-0456"
  },
  "patient_binding": {
    "method": "qr_scan",
    "operator_id": "NV-014",
    "bound_at": "2026-10-20T08:46:00+07:00"
  },
  "measurements": [
    {
      "code": {
        "system": "LOINC",
        "code": "8310-5",
        "display": "Body temperature"
      },
      "value": 37.3,
      "unit": "Cel",
      "status": "final",
      "quality": {
        "signal_quality": "good",
        "confidence": null
      },
      "device_flags": {},
      "body_site": null
    }
  ]
}