{
  "schema_version": "2.1",
  "message_id": "b2c3d4e5-3d70-4c9e-bf40-3d4e5f607182",
  "message_type": "observation.vitals",
  "clinic_id": "CLINIC001",
  "gateway_id": "GW-PI5-001",
  "sequence_no": 10237,
  "timestamps": {
    "measured_at": "2026-10-20T08:48:00.000+07:00",
    "received_at": "2026-10-20T08:48:00.200+07:00",
    "sent_at": "2026-10-20T08:48:00.700+07:00",
    "clock_source": "ntp"
  },
  "device": {
    "device_id": "WGT-09",
    "device_type": "weight_scale",
    "serial_number": "SN-WGT09-0001",
    "firmware_version": "1.0.0",
    "connection": "ble",
    "mac_address": "A4:C1:38:00:00:09",
    "device_class": "commercial"
  },
  "patient": {
    "patient_id": "BN-2026-000123",
    "encounter_id": "ENC-2026-0456"
  },
  "patient_binding": {
    "method": "qr_scan",
    "operator_id": "NV-014",
    "bound_at": "2026-10-20T08:46:00+07:00"
  },
  "measurements": [
    {
      "code": {
        "system": "LOINC",
        "code": "29463-7",
        "display": "Body weight"
      },
      "value": 64.3,
      "unit": "kg",
      "status": "final",
      "quality": {
        "signal_quality": "good",
        "confidence": null
      },
      "device_flags": {}
    }
  ]
}